"","ONET","ANZSCO3","ANZSCO2","ANZSCO1","ANZSCO4","Title","ONET.Title","Title1","Title2","Title3","Information.Content","Automation.Routinization","Face.to.Face","On.Site.Job","Decision.Making"
"182","39-3091.00","149","14","1",1491,"Amusement, Fitness and Sports Centre Managers","Amusement and Recreation Attendants","Managers","Hospitality, Retail and Service Managers","Miscellaneous Hospitality, Retail and Service Managers",0.41013798888556,0.602761242199926,0.719443045347861,0.402749048174972,0.495424356068628
"183","39-4021.00","451","45","4",4513,"Funeral Workers","Funeral Attendants","Community And Personal Service Workers","Sports and Personal Service Workers","Personal Service and Travel Workers",0.533721799360563,0.376264396279537,0.731549585139469,0.501084086920795,0.581013273183227
"184","39-5012.00","451","45","4",4511,"Beauty Therapists","Hairdressers, Hairstylists, and Cosmetologists","Community And Personal Service Workers","Sports and Personal Service Workers","Personal Service and Travel Workers",0.493107818962157,0.461669438990841,0.774233706209027,0.419288417283677,0.672974464983194
"185","39-5012.00","391","39","3",3911,"Hairdressers","Hairdressers, Hairstylists, and Cosmetologists","Technicians And Trades Workers","Other Technicians and Trades Workers","Hairdressers",0.493107818962157,0.461669438990841,0.774233706209027,0.419288417283677,0.672974464983194
"186","39-7011.00","452","45","4",4522,"Outdoor Adventure Guides","Tour Guides and Escorts","Community And Personal Service Workers","Sports and Personal Service Workers","Sports and Fitness Workers",0.509628666447377,0.40224490228665,0.684535503953925,0.360799250827635,0.575508887231928
"187","39-7011.00","451","45","4",4514,"Gallery, Museum and Tour Guides","Tour Guides and Escorts","Community And Personal Service Workers","Sports and Personal Service Workers","Personal Service and Travel Workers",0.509628666447377,0.40224490228665,0.684535503953925,0.360799250827635,0.575508887231928
"188","39-9011.00","421","42","4",4211,"Child Carers","Childcare Workers","Community And Personal Service Workers","Carers and Aides","Child Carers",0.463856015636451,0.407068511400424,0.713246636014747,0.39485268543601,0.630009445318275
"189","39-9021.00","451","45","4",4515,"Personal Care Consultants","Personal Care Aides","Community And Personal Service Workers","Sports and Personal Service Workers","Personal Service and Travel Workers",0.502897486126845,0.39736893788293,0.627927292847097,0.396712103344087,0.544650219197184
"190","39-9021.00","423","42","4",4231,"Aged and Disabled Carers","Personal Care Aides","Community And Personal Service Workers","Carers and Aides","Personal Carers and Assistants",0.502897486126845,0.39736893788293,0.627927292847097,0.396712103344087,0.544650219197184
"191","39-9021.00","451","45","4",4518,"Other Personal Service Workers","Personal Care Aides","Community And Personal Service Workers","Sports and Personal Service Workers","Personal Service and Travel Workers",0.502897486126845,0.39736893788293,0.627927292847097,0.396712103344087,0.544650219197184
"192","39-9021.00","423","42","4",4234,"Special Care Workers","Personal Care Aides","Community And Personal Service Workers","Carers and Aides","Personal Carers and Assistants",0.502897486126845,0.39736893788293,0.627927292847097,0.396712103344087,0.544650219197184
"193","39-9021.00","423","42","4",4233,"Nursing Support and Personal Care Workers","Personal Care Aides","Community And Personal Service Workers","Carers and Aides","Personal Carers and Assistants",0.502897486126845,0.39736893788293,0.627927292847097,0.396712103344087,0.544650219197184
"194","39-9031.00","452","45","4",4521,"Fitness Instructors","Fitness Trainers and Aerobics Instructors","Community And Personal Service Workers","Sports and Personal Service Workers","Sports and Fitness Workers",0.489065179856779,0.42013728597088,0.834861719004142,0.448611225820373,0.644092482191361
"195","41-1011.00","142","14","1",1421,"Retail Managers","First-Line Supervisors of Retail Sales Workers","Managers","Hospitality, Retail and Service Managers","Retail Managers",0.598010513763397,0.438137656136666,0.743582654279058,0.48025189408373,0.708959088582367
"196","41-1011.00","621","62","6",6215,"Retail Supervisors","First-Line Supervisors of Retail Sales Workers","Sales Workers","Sales Assistants and Salespersons","Sales Assistants and Salespersons",0.598010513763397,0.438137656136666,0.743582654279058,0.48025189408373,0.708959088582367
"197","41-1012.00","149","14","1",1492,"Call or Contact Centre and Customer Service Managers","First-Line Supervisors of Non-Retail Sales Workers","Managers","Hospitality, Retail and Service Managers","Miscellaneous Hospitality, Retail and Service Managers",0.770950292772354,0.368171100213121,0.787454019490052,0.301032402777427,0.865632588702679
"198","41-2011.00","631","63","6",6311,"Checkout Operators and Office Cashiers","Cashiers","Sales Workers","Sales Support Workers","Checkout Operators and Office Cashiers",0.469004077109834,0.587873601945285,0.666592449009854,0.369683394521688,0.475587368284014
"199","41-2022.00","621","62","6",6213,"Motor Vehicle and Vehicle Parts Salespersons","Parts Salespersons","Sales Workers","Sales Assistants and Salespersons","Sales Assistants and Salespersons",0.582819042005225,0.510893357891184,0.63980879445093,0.367109916756946,0.572734242344753
"200","41-2031.00","621","62","6",6219,"Other Sales Assistants and Salespersons","Retail Salespersons","Sales Workers","Sales Assistants and Salespersons","Sales Assistants and Salespersons",0.593663568833437,0.418013713164734,0.742308954204353,0.466841209521408,0.622438187607308
"201","41-2031.00","639","63","6",6399,"Other Sales Support Workers","Retail Salespersons","Sales Workers","Sales Support Workers","Miscellaneous Sales Support Workers",0.593663568833437,0.418013713164734,0.742308954204353,0.466841209521408,0.622438187607308
"202","41-2031.00","621","62","6",6211,"Sales Assistants (General)","Retail Salespersons","Sales Workers","Sales Assistants and Salespersons","Sales Assistants and Salespersons",0.593663568833437,0.418013713164734,0.742308954204353,0.466841209521408,0.622438187607308
"203","41-3021.00","611","61","6",6111,"Auctioneers, and Stock and Station Agents","Insurance Sales Agents","Sales Workers","Sales Representatives and Agents","Insurance Agents and Sales Representatives",0.665039390675819,0.439162418223473,0.726268975328615,0.25667011163841,0.702812863961613
"204","41-3021.00","611","61","6",6112,"Insurance Agents","Insurance Sales Agents","Sales Workers","Sales Representatives and Agents","Insurance Agents and Sales Representatives",0.665039390675819,0.439162418223473,0.726268975328615,0.25667011163841,0.702812863961613
"205","41-3021.00","611","61","6",6113,"Sales Representatives","Insurance Sales Agents","Sales Workers","Sales Representatives and Agents","Insurance Agents and Sales Representatives",0.665039390675819,0.439162418223473,0.726268975328615,0.25667011163841,0.702812863961613
"206","41-3031.01","222","22","2",2222,"Financial Dealers","Sales Agents, Securities and Commodities","Professionals","Business, Human Resource and Marketing Professionals","Financial Brokers and Dealers, and Investment Advisers",0.811127756791544,0.497076553727266,0.776140065675048,0.226962398239469,0.748095180817995
"207","41-9012.00","639","63","6",6391,"Models and Sales Demonstrators","Models","Sales Workers","Sales Support Workers","Miscellaneous Sales Support Workers",0.228212722623864,0.350781225232727,0.431625915565341,0.136348012083971,0.367280431165501
"208","41-9022.00","612","61","6",6121,"Real Estate Sales Agents","Real Estate Sales Agents","Sales Workers","Sales Representatives and Agents","Real Estate Sales Agents",0.723034383570225,0.325714768965859,0.767094362310082,0.359579501086597,0.666664723949566
"209","41-9031.00","225","22","2",2254,"Technical Sales Representatives","Sales Engineers","Professionals","Business, Human Resource and Marketing Professionals","Sales, Marketing and Public Relations Professionals",0.797455794763891,0.470477536265981,0.758634813285926,0.406014081794669,0.779190463132757
"210","41-9031.00","225","22","2",2252,"ICT Sales Professionals","Sales Engineers","Professionals","Business, Human Resource and Marketing Professionals","Sales, Marketing and Public Relations Professionals",0.797455794763891,0.470477536265981,0.758634813285926,0.406014081794669,0.779190463132757
"211","41-9031.00","621","62","6",6212,"ICT Sales Assistants","Sales Engineers","Sales Workers","Sales Assistants and Salespersons","Sales Assistants and Salespersons",0.797455794763891,0.470477536265981,0.758634813285926,0.406014081794669,0.779190463132757
"212","41-9041.00","541","54","5",5411,"Call or Contact Centre Workers","Telemarketers","Clerical And Administrative Workers","Inquiry Clerks and Receptionists","Call or Contact Centre Information Clerks",0.542887022431768,0.585148638089919,0.524022646665394,0.225524500879348,0.474801041311764
"213","41-9041.00","639","63","6",6393,"Telemarketers","Telemarketers","Sales Workers","Sales Support Workers","Miscellaneous Sales Support Workers",0.542887022431768,0.585148638089919,0.524022646665394,0.225524500879348,0.474801041311764
"214","41-9091.00","621","62","6",6217,"Street Vendors and Related Salespersons","Door-To-Door Sales Workers, News and Street Vendors, and Related Workers","Sales Workers","Sales Assistants and Salespersons","Sales Assistants and Salespersons",0.440270943467528,0.291859093032778,0.705413075434122,0.209181631023071,0.520582493604874
"215","43-2011.00","561","56","5",5616,"Switchboard Operators","Switchboard Operators, Including Answering Service","Clerical And Administrative Workers","Clerical and Office Support Workers","Clerical and Office Support Workers",0.548683433488496,0.578717722809251,0.62257426738252,0.251182542503058,0.496845757518533
"216","43-3011.00","599","59","5",5993,"Debt Collectors","Bill and Account Collectors","Clerical And Administrative Workers","Other Clerical and Administrative Workers","Miscellaneous Clerical and Administrative Workers",0.724117767792757,0.572555655793041,0.612259498502864,0.244446473890304,0.59036645652999
"217","43-3031.00","551","55","5",5511,"Accounting Clerks","Bookkeeping, Accounting, and Auditing Clerks","Clerical And Administrative Workers","Numerical Clerks","Accounting Clerks and Bookkeepers",0.751932010292567,0.551385393701089,0.575875361443322,0.251678902718971,0.592456856117694
"218","43-3031.00","551","55","5",5512,"Bookkeepers","Bookkeeping, Accounting, and Auditing Clerks","Clerical And Administrative Workers","Numerical Clerks","Accounting Clerks and Bookkeepers",0.751932010292567,0.551385393701089,0.575875361443322,0.251678902718971,0.592456856117694
"219","43-3051.00","551","55","5",5513,"Payroll Clerks","Payroll and Timekeeping Clerks","Clerical And Administrative Workers","Numerical Clerks","Accounting Clerks and Bookkeepers",0.6921953136016,0.532927923333671,0.559860594835712,0.23959407455764,0.55587656006054
"220","43-3061.00","591","59","5",5911,"Purchasing and Supply Logistics Clerks","Procurement Clerks","Clerical And Administrative Workers","Other Clerical and Administrative Workers","Logistics Clerks",0.72033372084905,0.555143539735319,0.657443547510825,0.300422885126277,0.651929545470317
"221","43-3071.00","552","55","5",5521,"Bank Workers","Tellers","Clerical And Administrative Workers","Numerical Clerks","Financial and Insurance Clerks",0.630032271219704,0.606835809936459,0.663546406033597,0.373754512973239,0.600296599712683
"222","43-4011.00","222","22","2",2221,"Financial Brokers","Brokerage Clerks","Professionals","Business, Human Resource and Marketing Professionals","Financial Brokers and Dealers, and Investment Advisers",0.741719099097082,0.531452868232126,0.637326749080061,0.299894666566947,0.635160722925408
"223","43-4071.00","561","56","5",5613,"Filing and Registry Clerks","File Clerks","Clerical And Administrative Workers","Clerical and Office Support Workers","Clerical and Office Support Workers",0.641415603715796,0.498920070776232,0.637486854601049,0.355161830064182,0.567445959112556
"224","43-4111.00","561","56","5",5615,"Survey Interviewers","Interviewers, Except Eligibility and Loan","Clerical And Administrative Workers","Clerical and Office Support Workers","Clerical and Office Support Workers",0.686155408181342,0.62454110640875,0.709755981323479,0.31079648401007,0.594941795050508
"225","43-4121.00","599","59","5",5997,"Library Assistants","Library Assistants, Clerical","Clerical And Administrative Workers","Other Clerical and Administrative Workers","Miscellaneous Clerical and Administrative Workers",0.710807705816993,0.53612144241726,0.693882172567191,0.439173436802604,0.574441659592402
"226","43-4161.00","599","59","5",5994,"Human Resource Clerks","Human Resources Assistants, Except Payroll and Timekeeping","Clerical And Administrative Workers","Other Clerical and Administrative Workers","Miscellaneous Clerical and Administrative Workers",0.737998449049714,0.520771548462618,0.67286566481277,0.265498832723403,0.565401613248939
"227","43-4171.00","542","54","5",5421,"Receptionists","Receptionists and Information Clerks","Clerical And Administrative Workers","Inquiry Clerks and Receptionists","Receptionists",0.591185878535006,0.519374750923339,0.683405183148625,0.32564913048394,0.49065900094675
"228","43-4171.00","541","54","5",5412,"Inquiry Clerks","Receptionists and Information Clerks","Clerical And Administrative Workers","Inquiry Clerks and Receptionists","Call or Contact Centre Information Clerks",0.591185878535006,0.519374750923339,0.683405183148625,0.32564913048394,0.49065900094675
"229","43-4181.00","451","45","4",4516,"Tourism and Travel Advisers","Reservation and Transportation Ticket Agents and Travel Clerks","Community And Personal Service Workers","Sports and Personal Service Workers","Personal Service and Travel Workers",0.762157311371076,0.705952589416259,0.754401493625006,0.397253986752917,0.572833811356253
"230","43-4181.00","639","63","6",6394,"Ticket Salespersons","Reservation and Transportation Ticket Agents and Travel Clerks","Sales Workers","Sales Support Workers","Miscellaneous Sales Support Workers",0.762157311371076,0.705952589416259,0.754401493625006,0.397253986752917,0.572833811356253
"231","43-5011.00","591","59","5",5912,"Transport and Despatch Clerks","Cargo and Freight Agents","Clerical And Administrative Workers","Other Clerical and Administrative Workers","Logistics Clerks",0.695313646913615,0.508370057498164,0.607789734535401,0.374309994633642,0.666645512254088
"232","43-5021.00","561","56","5",5612,"Couriers and Postal Deliverers","Couriers and Messengers","Clerical And Administrative Workers","Clerical and Office Support Workers","Clerical and Office Support Workers",0.575902070084109,0.44313964970722,0.642124965346428,0.505611799609803,0.563311467716436
"233","43-5053.00","561","56","5",5614,"Mail Sorters","Postal Service Mail Sorters, Processors, and Processing Machine Operators","Clerical And Administrative Workers","Clerical and Office Support Workers","Clerical and Office Support Workers",0.494034432716282,0.700566094089446,0.537509838662495,0.500573829360421,0.52533728145386
"234","43-5061.00","511","51","5",5111,"Contract, Program and Project Administrators","Production, Planning, and Expediting Clerks","Clerical And Administrative Workers","Office Managers and Program Administrators","Contract, Program and Project Administrators",0.69271859990928,0.527027750217158,0.624603228887762,0.363719832404163,0.712665009146202
"235","43-5081.03","741","74","7",7411,"Storepersons","Stock Clerks- Stockroom, Warehouse, or Storage Yard","Machinery Operators And Drivers","Storepersons","Storepersons",0.443209183571462,0.495002429105203,0.576342202822626,0.495910654129003,0.490760052595678
"236","43-6011.00","512","51","5",5121,"Office Managers","Executive Secretaries and Executive Administrative Assistants","Clerical And Administrative Workers","Office Managers and Program Administrators","Office and Practice Managers",0.721328369468683,0.502547903213926,0.727273700257974,0.31408451545608,0.580620552034903
"237","43-6011.00","521","52","5",5212,"Secretaries","Executive Secretaries and Executive Administrative Assistants","Clerical And Administrative Workers","Personal Assistants and Secretaries","Personal Assistants and Secretaries",0.721328369468683,0.502547903213926,0.727273700257974,0.31408451545608,0.580620552034903
"238","43-6011.00","512","51","5",5122,"Practice Managers","Executive Secretaries and Executive Administrative Assistants","Clerical And Administrative Workers","Office Managers and Program Administrators","Office and Practice Managers",0.721328369468683,0.502547903213926,0.727273700257974,0.31408451545608,0.580620552034903
"239","43-6011.00","521","52","5",5211,"Personal Assistants","Executive Secretaries and Executive Administrative Assistants","Clerical And Administrative Workers","Personal Assistants and Secretaries","Personal Assistants and Secretaries",0.721328369468683,0.502547903213926,0.727273700257974,0.31408451545608,0.580620552034903
"240","43-6012.00","599","59","5",5991,"Conveyancers and Legal Executives","Legal Secretaries","Clerical And Administrative Workers","Other Clerical and Administrative Workers","Miscellaneous Clerical and Administrative Workers",0.759210997394273,0.548689117244518,0.637410968603148,0.289128774341892,0.559060636027396
"241","43-9021.00","532","53","5",5321,"Keyboard Operators","Data Entry Keyers","Clerical And Administrative Workers","General Clerical Workers","Keyboard Operators",0.828677803133036,0.611042614711455,0.597268649177383,0.31494186803216,0.581580732838645
"242","43-9061.00","599","59","5",5999,"Other Miscellaneous Clerical and Administrative Workers","Office Clerks, General","Clerical And Administrative Workers","Other Clerical and Administrative Workers","Miscellaneous Clerical and Administrative Workers",0.657916690925266,0.500775746309421,0.661114232875455,0.353269130922973,0.499607268709514
"243","43-9061.00","531","53","5",5311,"General Clerks","Office Clerks, General","Clerical And Administrative Workers","General Clerical Workers","General Clerks",0.657916690925266,0.500775746309421,0.661114232875455,0.353269130922973,0.499607268709514
"244","43-9061.00","561","56","5",5619,"Other Clerical and Office Support Workers","Office Clerks, General","Clerical And Administrative Workers","Clerical and Office Support Workers","Clerical and Office Support Workers",0.657916690925266,0.500775746309421,0.661114232875455,0.353269130922973,0.499607268709514
"245","43-9111.00","552","55","5",5523,"Insurance, Money Market and Statistical Clerks","Statistical Assistants","Clerical And Administrative Workers","Numerical Clerks","Financial and Insurance Clerks",0.842866509601989,0.433551471850051,0.581476109403564,0.232853464514938,0.679200366115156
"246","45-2091.00","311","31","3",3111,"Agricultural Technicians","Agricultural Equipment Operators","Technicians And Trades Workers","Engineering, ICT and Science Technicians","Agricultural, Medical and Science Technicians",0.44586949905443,0.571089694735015,0.49591574539568,0.773110454565752,0.549228183835166
"247","45-2091.00","721","72","7",7211,"Agricultural, Forestry and Horticultural Plant Operators","Agricultural Equipment Operators","Machinery Operators And Drivers","Mobile Plant Operators","Mobile Plant Operators",0.44586949905443,0.571089694735015,0.49591574539568,0.773110454565752,0.549228183835166
"248","45-2092.01","841","84","8",8414,"Garden and Nursery Labourers","Nursery Workers","Labourers","Farm, Forestry and Garden Workers","Farm, Forestry and Garden Workers",0.467291432915174,0.56309183956966,0.609545794348311,0.558130508504295,0.486462939610892
"249","45-2092.01","362","36","3",3624,"Nurserypersons","Nursery Workers","Technicians And Trades Workers","Skilled Animal and Horticultural Workers","Horticultural Trades Workers",0.467291432915174,0.56309183956966,0.609545794348311,0.558130508504295,0.486462939610892
"250","45-2092.02","841","84","8",8419,"Other Farm, Forestry and Garden Workers","Farmworkers and Laborers, Crop","Labourers","Farm, Forestry and Garden Workers","Farm, Forestry and Garden Workers",0.274022863063522,0.662637511056187,0.448186059798015,0.469337690971627,0.474897915681612
"251","45-2092.02","841","84","8",8412,"Crop Farm Workers","Farmworkers and Laborers, Crop","Labourers","Farm, Forestry and Garden Workers","Farm, Forestry and Garden Workers",0.274022863063522,0.662637511056187,0.448186059798015,0.469337690971627,0.474897915681612
"252","45-2093.00","361","36","3",3612,"Shearers","Farmworkers, Farm, Ranch, and Aquacultural Animals","Technicians And Trades Workers","Skilled Animal and Horticultural Workers","Animal Attendants and Trainers, and Shearers",0.511167080951207,0.505164743118228,0.654125009099429,0.740226225579731,0.65535549861845
"253","45-2093.00","841","84","8",8411,"Aquaculture Workers","Farmworkers, Farm, Ranch, and Aquacultural Animals","Labourers","Farm, Forestry and Garden Workers","Farm, Forestry and Garden Workers",0.511167080951207,0.505164743118228,0.654125009099429,0.740226225579731,0.65535549861845
"254","45-2093.00","841","84","8",8416,"Mixed Crop and Livestock Farm Workers","Farmworkers, Farm, Ranch, and Aquacultural Animals","Labourers","Farm, Forestry and Garden Workers","Farm, Forestry and Garden Workers",0.511167080951207,0.505164743118228,0.654125009099429,0.740226225579731,0.65535549861845
"255","45-2093.00","841","84","8",8415,"Livestock Farm Workers","Farmworkers, Farm, Ranch, and Aquacultural Animals","Labourers","Farm, Forestry and Garden Workers","Farm, Forestry and Garden Workers",0.511167080951207,0.505164743118228,0.654125009099429,0.740226225579731,0.65535549861845
"256","45-3011.00","899","89","8",8992,"Deck and Fishing Hands","Fishers and Related Fishing Workers","Labourers","Other Labourers","Miscellaneous Labourers",0.418914241327909,0.636172096944035,0.528561362649223,0.664358405505189,0.584908909125279
"257","45-4011.00","841","84","8",8413,"Forestry and Logging Workers","Forest and Conservation Workers","Labourers","Farm, Forestry and Garden Workers","Farm, Forestry and Garden Workers",0.567111906414399,0.555261304316398,0.661599748582429,0.628678944015952,0.70868721543402
"258","47-2021.00","331","33","3",3311,"Bricklayers and Stonemasons","Brickmasons and Blockmasons","Technicians And Trades Workers","Construction Trades Workers","Bricklayers, and Carpenters and Joiners",0.508052787476905,0.549825176455549,0.628579490223976,0.785334200196776,0.701458093745286
"259","47-2031.01","331","33","3",3312,"Carpenters and Joiners","Construction Carpenters","Technicians And Trades Workers","Construction Trades Workers","Bricklayers, and Carpenters and Joiners",0.452970933692802,0.460202043411766,0.598975498260965,0.66780145484769,0.625977280871396
"260","47-2043.00","332","33","3",3321,"Floor Finishers","Floor Sanders and Finishers","Technicians And Trades Workers","Construction Trades Workers","Floor Finishers and Painting Trades Workers",0.378253582734278,0.537100976687714,0.551972617390089,0.678023110978716,0.635533449273197
"261","47-2044.00","333","33","3",3334,"Wall and Floor Tilers","Tile and Marble Setters","Technicians And Trades Workers","Construction Trades Workers","Glaziers, Plasterers and Tilers",0.439298606958853,0.451191555754307,0.577270333228233,0.64406415914865,0.701785535035279
"262","47-2051.00","821","82","8",8212,"Concreters","Cement Masons and Concrete Finishers","Labourers","Construction and Mining Labourers","Construction and Mining Labourers",0.458636905359071,0.551859619566233,0.517978793547523,0.651571010358378,0.666497928272739
"263","47-2061.00","821","82","8",8219,"Other Construction and Mining Labourers","Construction Laborers","Labourers","Construction and Mining Labourers","Construction and Mining Labourers",0.50941223179475,0.554752318014753,0.561151863703137,0.712562740673646,0.626346848944629
"264","47-2073.00","721","72","7",7212,"Earthmoving Plant Operators","Operating Engineers and Other Construction Equipment Operators","Machinery Operators And Drivers","Mobile Plant Operators","Mobile Plant Operators",0.573602315522893,0.561731288142755,0.604025917795244,0.799282878362731,0.673519031347783
"265","47-2111.00","341","34","3",3411,"Electricians","Electricians","Technicians And Trades Workers","Electrotechnology and Telecommunications Trades Workers","Electricians",0.546679901890275,0.437466025751273,0.612154366412817,0.756879412457608,0.659020731719551
"266","47-2121.00","333","33","3",3331,"Glaziers","Glaziers","Technicians And Trades Workers","Construction Trades Workers","Glaziers, Plasterers and Tilers",0.387925148660901,0.47749863413298,0.555315127648971,0.557290114407089,0.566560286722039
"267","47-2131.00","821","82","8",8214,"Insulation and Home Improvement Installers","Insulation Workers, Floor, Ceiling, and Wall","Labourers","Construction and Mining Labourers","Construction and Mining Labourers",0.463100887773003,0.53589740504114,0.551943848388903,0.619435433352514,0.580212974462046
"268","47-2152.02","334","33","3",3341,"Plumbers","Plumbers","Technicians And Trades Workers","Construction Trades Workers","Plumbers",0.546805685660093,0.436338815083346,0.689332834412981,0.745274638532022,0.758252921271165
"269","47-2161.00","333","33","3",3332,"Plasterers","Plasterers and Stucco Masons","Technicians And Trades Workers","Construction Trades Workers","Glaziers, Plasterers and Tilers",0.482858550559879,0.576283369766088,0.637194920083884,0.619012800548995,0.69065648402547
"270","47-2181.00","333","33","3",3333,"Roof Tilers","Roofers","Technicians And Trades Workers","Construction Trades Workers","Glaziers, Plasterers and Tilers",0.437363104519587,0.592446867891485,0.598442311676011,0.654763172637739,0.738342160886298
