"","ONET","ANZSCO3","ANZSCO2","ANZSCO1","ANZSCO4","Title","ONET.Title","Title1","Title2","Title3","Information.Content","Automation.Routinization","Face.to.Face","On.Site.Job","Decision.Making"
"1","11-1011.00","111","11","1",1111,"Chief Executives and Managing Directors","Chief Executives","Managers","Chief Executives, General Managers and Legislators","Chief Executives, General Managers and Legislators",0.670248883887662,0.386005420748405,0.748467074552968,0.228939489478207,0.942136538892276
"2","11-1011.00","111","11","1",1113,"Legislators","Chief Executives","Managers","Chief Executives, General Managers and Legislators","Chief Executives, General Managers and Legislators",0.670248883887662,0.386005420748405,0.748467074552968,0.228939489478207,0.942136538892276
"3","11-1021.00","111","11","1",1112,"General Managers","General and Operations Managers","Managers","Chief Executives, General Managers and Legislators","Chief Executives, General Managers and Legislators",0.68728346403863,0.394968793521858,0.74270275802623,0.474778921165245,0.798047250342253
"4","11-2011.00","131","13","1",1311,"Advertising, Public Relations and Sales Managers","Advertising and Promotions Managers","Managers","Specialist Managers","Advertising, Public Relations and Sales Managers",0.6785221956139,0.462773956731924,0.693423357419549,0.342559799657867,0.797827015539268
"5","11-3011.00","132","13","1",1321,"Corporate Services Managers","Administrative Services Managers","Managers","Specialist Managers","Business Administration Managers",0.755348845577073,0.453144231755345,0.711047839537032,0.355916685802345,0.725409392431761
"6","11-3011.00","132","13","1",1324,"Policy and Planning Managers","Administrative Services Managers","Managers","Specialist Managers","Business Administration Managers",0.755348845577073,0.453144231755345,0.711047839537032,0.355916685802345,0.725409392431761
"7","11-3021.00","135","13","1",1351,"ICT Managers","Computer and Information Systems Managers","Managers","Specialist Managers","ICT Managers",0.866357146542268,0.414683996086017,0.765549638098463,0.498199754497233,0.845412855344133
"8","11-3031.02","132","13","1",1322,"Finance Managers","Financial Managers, Branch or Department","Managers","Specialist Managers","Business Administration Managers",0.806226131710937,0.448192469348242,0.823215275865385,0.253494093190076,0.835411414087225
"9","11-3051.00","133","13","1",1334,"Manufacturers","Industrial Production Managers","Managers","Specialist Managers","Construction, Distribution and Production Managers",0.68048385330731,0.488615395955333,0.697837362069297,0.50269696375556,0.812861953718086
"10","11-3051.00","133","13","1",1335,"Production Managers","Industrial Production Managers","Managers","Specialist Managers","Construction, Distribution and Production Managers",0.68048385330731,0.488615395955333,0.697837362069297,0.50269696375556,0.812861953718086
"11","11-3061.00","133","13","1",1333,"Importers, Exporters and Wholesalers","Purchasing Managers","Managers","Specialist Managers","Construction, Distribution and Production Managers",0.736062305400711,0.449671744338319,0.721712163977676,0.277567229799769,0.770047287489147
"12","11-3071.01","133","13","1",1336,"Supply and Distribution Managers","Transportation Managers","Managers","Specialist Managers","Construction, Distribution and Production Managers",0.757850179371999,0.413810733999484,0.715973210659459,0.307658223252281,0.769317370021772
"13","11-3071.01","149","14","1",1494,"Transport Services Managers","Transportation Managers","Managers","Hospitality, Retail and Service Managers","Miscellaneous Hospitality, Retail and Service Managers",0.757850179371999,0.413810733999484,0.715973210659459,0.307658223252281,0.769317370021772
"14","11-3121.00","132","13","1",1323,"Human Resource Managers","Human Resources Managers","Managers","Specialist Managers","Business Administration Managers",0.730651443270868,0.372241186407935,0.780873756940796,0.204222109636281,0.757236692924792
"15","11-9013.01","121","12","1",1212,"Crop Farmers","Nursery and Greenhouse Managers","Managers","Farmers and Farm Managers","Farmers and Farm Managers",0.712506546620606,0.459556814284585,0.745261601372859,0.654004134093245,0.813306726000397
"16","11-9013.01","121","12","1",1213,"Livestock Farmers","Nursery and Greenhouse Managers","Managers","Farmers and Farm Managers","Farmers and Farm Managers",0.712506546620606,0.459556814284585,0.745261601372859,0.654004134093245,0.813306726000397
"17","11-9013.01","121","12","1",1214,"Mixed Crop and Livestock Farmers","Nursery and Greenhouse Managers","Managers","Farmers and Farm Managers","Farmers and Farm Managers",0.712506546620606,0.459556814284585,0.745261601372859,0.654004134093245,0.813306726000397
"18","11-9013.03","121","12","1",1211,"Aquaculture Farmers","Aquacultural Managers","Managers","Farmers and Farm Managers","Farmers and Farm Managers",0.758298540052759,0.431592944602615,0.746422365640434,0.67823901066233,0.804356423439102
"19","11-9021.00","133","13","1",1331,"Construction Managers","Construction Managers","Managers","Specialist Managers","Construction, Distribution and Production Managers",0.789335405378992,0.402468527474328,0.689425194783812,0.419689315959925,0.756287366835071
"20","11-9031.00","134","13","1",1341,"Child Care Centre Managers","Education Administrators, Preschool and Childcare Center/Program","Managers","Specialist Managers","Education, Health and Welfare Services Managers",0.656996036504154,0.374680631579672,0.832331285558723,0.367751087870782,0.787757088789387
"21","11-9032.00","134","13","1",1343,"School Principals","Education Administrators, Elementary and Secondary School","Managers","Specialist Managers","Education, Health and Welfare Services Managers",0.804726396245465,0.327271571227098,0.886776992088757,0.352369189502346,0.886062871312918
"22","11-9032.00","134","13","1",1344,"Other Education Managers","Education Administrators, Elementary and Secondary School","Managers","Specialist Managers","Education, Health and Welfare Services Managers",0.804726396245465,0.327271571227098,0.886776992088757,0.352369189502346,0.886062871312918
"23","11-9033.00","132","13","1",1325,"Research and Development Managers","Education Administrators, Postsecondary","Managers","Specialist Managers","Business Administration Managers",0.801701164550614,0.37220548021441,0.791360923957977,0.304229401118664,0.855994647792735
"24","11-9041.00","133","13","1",1332,"Engineering Managers","Architectural and Engineering Managers","Managers","Specialist Managers","Construction, Distribution and Production Managers",0.79588777490987,0.386605102349842,0.633207343284529,0.362403409229488,0.82314332817058
"25","11-9051.00","141","14","1",1411,"Cafe and Restaurant Managers","Food Service Managers","Managers","Hospitality, Retail and Service Managers","Accommodation and Hospitality Managers",0.675410437692853,0.538768988996152,0.793305133272926,0.555057521286232,0.744786671819137
"26","11-9051.00","141","14","1",1414,"Licensed Club Managers","Food Service Managers","Managers","Hospitality, Retail and Service Managers","Accommodation and Hospitality Managers",0.675410437692853,0.538768988996152,0.793305133272926,0.555057521286232,0.744786671819137
"27","11-9081.00","141","14","1",1419,"Other Accommodation and Hospitality Managers","Lodging Managers","Managers","Hospitality, Retail and Service Managers","Accommodation and Hospitality Managers",0.754231915567864,0.442252674750746,0.867993606874034,0.486573233709597,0.834148055707386
"28","11-9081.00","141","14","1",1412,"Caravan Park and Camping Ground Managers","Lodging Managers","Managers","Hospitality, Retail and Service Managers","Accommodation and Hospitality Managers",0.754231915567864,0.442252674750746,0.867993606874034,0.486573233709597,0.834148055707386
"29","11-9081.00","141","14","1",1413,"Hotel and Motel Managers","Lodging Managers","Managers","Hospitality, Retail and Service Managers","Accommodation and Hospitality Managers",0.754231915567864,0.442252674750746,0.867993606874034,0.486573233709597,0.834148055707386
"30","11-9111.00","134","13","1",1342,"Health and Welfare Services Managers","Medical and Health Services Managers","Managers","Specialist Managers","Education, Health and Welfare Services Managers",0.805141990636041,0.427645516587079,0.856598031468747,0.360347660664898,0.844051315544504
"31","13-1021.00","639","63","6",6392,"Retail and Wool Buyers","Buyers and Purchasing Agents, Farm Products","Sales Workers","Sales Support Workers","Miscellaneous Sales Support Workers",0.648199089957623,0.465117565950401,0.613065283806944,0.447239156278674,0.674122454411906
"32","13-1031.02","599","59","5",5996,"Insurance Investigators, Loss Adjusters and Risk Surveyors","Insurance Adjusters, Examiners, and Investigators","Clerical And Administrative Workers","Other Clerical and Administrative Workers","Miscellaneous Clerical and Administrative Workers",0.785706516218032,0.542828181041487,0.625190254549744,0.397402145999841,0.600713353966314
"33","13-1071.00","223","22","2",2231,"Human Resource Professionals","Human Resources Specialists","Professionals","Business, Human Resource and Marketing Professionals","Human Resource and Training Professionals",0.751474364834334,0.501486446775253,0.727322319315782,0.283430508494629,0.702144182543778
"34","13-1111.00","224","22","2",2247,"Management and Organisation Analysts","Management Analysts","Professionals","Business, Human Resource and Marketing Professionals","Information and Organisation Professionals",0.834636036317116,0.389615758936749,0.72865921960265,0.354525413352824,0.737805869713721
"35","13-1121.00","149","14","1",1493,"Conference and Event Organisers","Meeting, Convention, and Event Planners","Managers","Hospitality, Retail and Service Managers","Miscellaneous Hospitality, Retail and Service Managers",0.609482480570168,0.4523748752375,0.754104719132831,0.342410181453756,0.668344462122788
"36","13-1161.00","225","22","2",2251,"Advertising and Marketing Professionals","Market Research Analysts and Marketing Specialists","Professionals","Business, Human Resource and Marketing Professionals","Sales, Marketing and Public Relations Professionals",0.873691651409572,0.4393149165717,0.629215779696568,0.241516101659558,0.744169041339531
"37","13-2011.01","221","22","2",2211,"Accountants","Accountants","Professionals","Business, Human Resource and Marketing Professionals","Accountants, Auditors and Company Secretaries",0.810198575132056,0.544909860659633,0.600046871753195,0.2123601458831,0.643652023559853
"38","13-2011.01","221","22","2",2212,"Auditors, Company Secretaries and Corporate Treasurers","Accountants","Professionals","Business, Human Resource and Marketing Professionals","Accountants, Auditors and Company Secretaries",0.810198575132056,0.544909860659633,0.600046871753195,0.2123601458831,0.643652023559853
"39","13-2021.02","224","22","2",2245,"Land Economists and Valuers","Appraisers, Real Estate","Professionals","Business, Human Resource and Marketing Professionals","Information and Organisation Professionals",0.795818705267681,0.465681681976237,0.569727320265362,0.383013171799326,0.631297195632419
"40","13-2052.00","222","22","2",2223,"Financial Investment Advisers and Managers","Personal Financial Advisors","Professionals","Business, Human Resource and Marketing Professionals","Financial Brokers and Dealers, and Investment Advisers",0.816085058641123,0.461445205612482,0.764230756237112,0.225491167316583,0.819373442650687
"41","13-2072.00","552","55","5",5522,"Credit and Loans Officers (Aus) / Finance Clerks (NZ)","Loan Officers","Clerical And Administrative Workers","Numerical Clerks","Financial and Insurance Clerks",0.747772503956385,0.490769406170871,0.726109084644108,0.248183994435493,0.710111713890126
"42","15-1121.00","261","26","2",2611,"ICT Business and Systems Analysts","Computer Systems Analysts","Professionals","ICT Professionals","Business and Systems Analysts, and Programmers",0.83379105116342,0.525579464462253,0.634255516169384,0.403289421777014,0.722451119689628
"43","15-1132.00","261","26","2",2613,"Software and Applications Programmers","Software Developers, Applications","Professionals","ICT Professionals","Business and Systems Analysts, and Programmers",0.830383920496154,0.48195464401593,0.540207551706793,0.214471514537926,0.76043375858391
"44","15-1134.00","261","26","2",2612,"Multimedia Specialists and Web Developers","Web Developers","Professionals","ICT Professionals","Business and Systems Analysts, and Programmers",0.800167546274968,0.554151604464277,0.579173193673599,0.284886242498355,0.722305370496729
"45","15-1141.00","262","26","2",2621,"Database and Systems Administrators, and ICT Security Specialists","Database Administrators","Professionals","ICT Professionals","Database and Systems Administrators, and ICT Security Specialists",0.84585984965387,0.525504712097392,0.575310194480263,0.353736922361207,0.649482168021089
"46","15-1151.00","263","26","2",2631,"Computer Network Professionals","Computer User Support Specialists","Professionals","ICT Professionals","ICT Network and Support Professionals",0.78733567957959,0.484244172615417,0.647816295239301,0.538625547075501,0.703752956140473
"47","15-1151.00","313","31","3",3131,"ICT Support Technicians","Computer User Support Specialists","Technicians And Trades Workers","Engineering, ICT and Science Technicians","ICT and Telecommunications Technicians",0.78733567957959,0.484244172615417,0.647816295239301,0.538625547075501,0.703752956140473
"48","15-1199.01","263","26","2",2632,"ICT Support and Test Engineers","Software Quality Assurance Engineers and Testers","Professionals","ICT Professionals","ICT Network and Support Professionals",0.879799272705923,0.546413523175022,0.613045345247549,0.301859566521974,0.721291926315538
"49","15-1199.02","263","26","2",2633,"Telecommunications Engineering Professionals","Computer Systems Engineers/Architects","Professionals","ICT Professionals","ICT Network and Support Professionals",0.834345338157701,0.456853128662914,0.589382003883307,0.335696379237134,0.770456334497076
"50","15-2011.00","224","22","2",2241,"Actuaries, Mathematicians and Statisticians","Actuaries","Professionals","Business, Human Resource and Marketing Professionals","Information and Organisation Professionals",0.907345671842375,0.426954750797994,0.61719650894039,0.132879692861774,0.810176594915658
"51","15-2031.00","224","22","2",2249,"Other Information and Organisation Professionals","Operations Research Analysts","Professionals","Business, Human Resource and Marketing Professionals","Information and Organisation Professionals",0.870466021903974,0.347891598035594,0.594519124539644,0.128712086550919,0.756387705470777
"52","17-1011.00","232","23","2",2321,"Architects and Landscape Architects","Architects, Except Landscape and Naval","Professionals","Design, Engineering, Science and Transport Professionals","Architects, Designers, Planners and Surveyors",0.795897156276192,0.458598393328022,0.693324020217844,0.381738661239358,0.854637952552062
"53","17-1022.00","232","23","2",2322,"Surveyors and Spatial Scientists","Surveyors","Professionals","Design, Engineering, Science and Transport Professionals","Architects, Designers, Planners and Surveyors",0.893575911778336,0.528284389270037,0.753371355316672,0.658151451926388,0.775821115222454
"54","17-2021.00","234","23","2",2341,"Agricultural and Forestry Scientists","Agricultural Engineers","Professionals","Design, Engineering, Science and Transport Professionals","Natural and Physical Science Professionals",0.838727023874654,0.380400334957293,0.621150721118763,0.533821082432558,0.784938996762085
"55","17-2041.00","233","23","2",2331,"Chemical and Materials Engineers","Chemical Engineers","Professionals","Design, Engineering, Science and Transport Professionals","Engineering Professionals",0.84146773950998,0.413148726925281,0.655541872415964,0.428928513128781,0.772614630023587
"56","17-2051.00","233","23","2",2332,"Civil Engineering Professionals","Civil Engineers","Professionals","Design, Engineering, Science and Transport Professionals","Engineering Professionals",0.802376377315811,0.420986015547021,0.68308706132224,0.439797503089525,0.76195937415958
"57","17-2071.00","233","23","2",2333,"Electrical Engineers","Electrical Engineers","Professionals","Design, Engineering, Science and Transport Professionals","Engineering Professionals",0.818072408951724,0.420044789129821,0.573905606946095,0.490567757365142,0.761572000578254
"58","17-2072.00","233","23","2",2334,"Electronics Engineers","Electronics Engineers, Except Computer","Professionals","Design, Engineering, Science and Transport Professionals","Engineering Professionals",0.837437672545616,0.366649508050514,0.600341019300342,0.593463629845782,0.732031042972265
"59","17-2111.01","312","31","3",3126,"Safety Inspectors","Industrial Safety and Health Engineers","Technicians And Trades Workers","Engineering, ICT and Science Technicians","Building and Engineering Technicians",0.833062055382955,0.406282809256729,0.735383442728935,0.529022610443857,0.742676984513175
"60","17-2112.00","233","23","2",2335,"Industrial, Mechanical and Production Engineers","Industrial Engineers","Professionals","Design, Engineering, Science and Transport Professionals","Engineering Professionals",0.766236182611288,0.394001141229037,0.627402428634911,0.507433158237475,0.737548473489709
"61","17-2151.00","233","23","2",2336,"Mining Engineers","Mining and Geological Engineers, Including Mining Safety Engineers","Professionals","Design, Engineering, Science and Transport Professionals","Engineering Professionals",0.83556078537801,0.448385575937724,0.611262112707369,0.430585410534142,0.762807875987484
"62","17-2199.04","233","23","2",2339,"Other Engineering Professionals","Manufacturing Engineers","Professionals","Design, Engineering, Science and Transport Professionals","Engineering Professionals",0.808053048305256,0.466239829387247,0.66458233964643,0.623188180688096,0.780561442385536
"63","17-3022.00","312","31","3",3122,"Civil Engineering Draftspersons and Technicians","Civil Engineering Technicians","Technicians And Trades Workers","Engineering, ICT and Science Technicians","Building and Engineering Technicians",0.814631753714019,0.555972744330865,0.642709233085358,0.405113785468724,0.693345020024351
"64","17-3023.01","312","31","3",3124,"Electronic Engineering Draftspersons and Technicians","Electronics Engineering Technicians","Technicians And Trades Workers","Engineering, ICT and Science Technicians","Building and Engineering Technicians",0.659143965733067,0.446263648365059,0.548080495105431,0.586079588108775,0.618162634613872
"65","17-3023.03","312","31","3",3123,"Electrical Engineering Draftspersons and Technicians","Electrical Engineering Technicians","Technicians And Trades Workers","Engineering, ICT and Science Technicians","Building and Engineering Technicians",0.752869702144089,0.447835703944851,0.625845155421083,0.611073690446325,0.708662359570422
"66","17-3027.00","312","31","3",3125,"Mechanical Engineering Draftspersons and Technicians","Mechanical Engineering Technicians","Technicians And Trades Workers","Engineering, ICT and Science Technicians","Building and Engineering Technicians",0.710803671147943,0.442800477827589,0.59874058135143,0.722629012143062,0.695788666422602
"67","17-3029.05","312","31","3",3129,"Other Building and Engineering Technicians","Industrial Engineering Technologists","Technicians And Trades Workers","Engineering, ICT and Science Technicians","Building and Engineering Technicians",0.717675618220184,0.529628284038781,0.64410739533292,0.512048452134806,0.707771906325611
"68","17-3031.01","312","31","3",3121,"Architectural, Building and Surveying Technicians","Surveying Technicians","Technicians And Trades Workers","Engineering, ICT and Science Technicians","Building and Engineering Technicians",0.803919471485735,0.549715417571187,0.619589116541361,0.614697699737481,0.690471523423067
"69","19-1012.00","234","23","2",2342,"Chemists, and Food and Wine Scientists","Food Scientists and Technologists","Professionals","Design, Engineering, Science and Transport Professionals","Natural and Physical Science Professionals",0.811258519637544,0.474762659980756,0.63486457757261,0.49390996027066,0.746288003596611
"70","19-1020.01","234","23","2",2345,"Life Scientists","Biologists","Professionals","Design, Engineering, Science and Transport Professionals","Natural and Physical Science Professionals",0.844837736409294,0.417617193855535,0.588219260000249,0.432174796535602,0.703431097562683
"71","19-2032.00","234","23","2",2349,"Other Natural and Physical Science Professionals","Materials Scientists","Professionals","Design, Engineering, Science and Transport Professionals","Natural and Physical Science Professionals",0.876447598452744,0.38820445814601,0.601470032853874,0.565756764618714,0.748251651105335
"72","19-2041.00","234","23","2",2343,"Environmental Scientists","Environmental Scientists and Specialists, Including Health","Professionals","Design, Engineering, Science and Transport Professionals","Natural and Physical Science Professionals",0.776042141878034,0.381861931488078,0.672210581217698,0.47038295566636,0.704749771787077
"73","19-2042.00","234","23","2",2344,"Geologists and Geophysicists","Geoscientists, Except Hydrologists and Geographers","Professionals","Design, Engineering, Science and Transport Professionals","Natural and Physical Science Professionals",0.875912221334292,0.388118367965202,0.620364889539643,0.438893257761273,0.744365324623966
"74","19-3011.00","224","22","2",2243,"Economists","Economists","Professionals","Business, Human Resource and Marketing Professionals","Information and Organisation Professionals",0.855448864990609,0.318278357023364,0.594489740217464,0.157259322704995,0.719100687701415
"75","19-3031.02","272","27","2",2723,"Psychologists","Clinical Psychologists","Professionals","Legal, Social and Welfare Professionals","Social and Welfare Professionals",0.799824752787774,0.325221421758926,0.903777889922117,0.341041027715066,0.740631135972976
"76","19-3031.03","272","27","2",2721,"Counsellors","Counseling Psychologists","Professionals","Legal, Social and Welfare Professionals","Social and Welfare Professionals",0.751824055292337,0.286811583777908,0.897256777952297,0.19252142535852,0.767033900532342
"77","19-3041.00","272","27","2",2724,"Social Professionals","Sociologists","Professionals","Legal, Social and Welfare Professionals","Social and Welfare Professionals",0.887602948313592,0.360605806502858,0.652997833668071,0.130179403837829,0.742801466990073
"78","19-3051.00","232","23","2",2326,"Urban and Regional Planners","Urban and Regional Planners","Professionals","Design, Engineering, Science and Transport Professionals","Architects, Designers, Planners and Surveyors",0.751772098880036,0.440602804162767,0.659534913820347,0.192810721113304,0.762937540312616
"79","19-4011.01","311","31","3",3113,"Primary Products Inspectors","Agricultural Technicians","Technicians And Trades Workers","Engineering, ICT and Science Technicians","Agricultural, Medical and Science Technicians",0.674126196837386,0.529868317800407,0.529378591789246,0.572143232977836,0.584857815511438
"80","19-4031.00","311","31","3",3114,"Science Technicians","Chemical Technicians","Technicians And Trades Workers","Engineering, ICT and Science Technicians","Agricultural, Medical and Science Technicians",0.770770820279727,0.552643548386445,0.586297898116734,0.5846660845977,0.598087429425166
"81","21-1021.00","272","27","2",2725,"Social Workers","Child, Family, and School Social Workers","Professionals","Legal, Social and Welfare Professionals","Social and Welfare Professionals",0.744845808471347,0.381947642567212,0.828943919506876,0.296905978182301,0.747415373333601
"82","21-1022.00","411","41","4",4117,"Welfare Support Workers","Healthcare Social Workers","Community And Personal Service Workers","Health and Welfare Support Workers","Health and Welfare Support Workers",0.751751031354716,0.338385244482667,0.880042242608113,0.235294010747547,0.756704839090915
"83","21-1093.00","272","27","2",2726,"Welfare, Recreation and Community Arts Workers","Social and Human Service Assistants","Professionals","Legal, Social and Welfare Professionals","Social and Welfare Professionals",0.696706346732744,0.380448614838692,0.798682717132595,0.390292380063333,0.655529733725402
"84","21-2011.00","272","27","2",2722,"Ministers of Religion","Clergy","Professionals","Legal, Social and Welfare Professionals","Social and Welfare Professionals",0.738855129765479,0.262964537656055,0.937462016959613,0.401634630572098,0.875964918859833
"85","23-1011.00","271","27","2",2711,"Barristers","Lawyers","Professionals","Legal, Social and Welfare Professionals","Legal Professionals",0.80094948458676,0.4171803905554,0.718908946707729,0.191372829935607,0.850386033603862
"86","23-1011.00","271","27","2",2713,"Solicitors","Lawyers","Professionals","Legal, Social and Welfare Professionals","Legal Professionals",0.80094948458676,0.4171803905554,0.718908946707729,0.191372829935607,0.850386033603862
"87","23-1012.00","599","59","5",5992,"Court and Legal Clerks","Judicial Law Clerks","Clerical And Administrative Workers","Other Clerical and Administrative Workers","Miscellaneous Clerical and Administrative Workers",0.785582219249764,0.2,0.459631393217103,0.350301148456563,0.38375782559404
"88","23-1012.00","271","27","2",2712,"Judicial and Other Legal Professionals","Judicial Law Clerks","Professionals","Legal, Social and Welfare Professionals","Legal Professionals",0.785582219249764,0.2,0.459631393217103,0.350301148456563,0.38375782559404
