"","ONET","ANZSCO3","ANZSCO2","ANZSCO1","ANZSCO4","Title","ONET.Title","Title1","Title2","Title3","Information.Content","Automation.Routinization","Face.to.Face","On.Site.Job","Decision.Making"
"271","47-2211.00","322","32","3",3222,"Sheetmetal Trades Workers","Sheet Metal Workers","Technicians And Trades Workers","Automotive and Engineering Trades Workers","Fabrication Engineering Trades Workers",0.563879348272078,0.508019236115225,0.609115402038813,0.732448130386082,0.722689243249892
"272","47-2221.00","322","32","3",3223,"Structural Steel and Welding Trades Workers","Structural Iron and Steel Workers","Technicians And Trades Workers","Automotive and Engineering Trades Workers","Fabrication Engineering Trades Workers",0.521619024521523,0.499529758947516,0.60285769692703,0.815720887167023,0.704753408246783
"273","47-2221.00","821","82","8",8217,"Structural Steel Construction Workers","Structural Iron and Steel Workers","Labourers","Construction and Mining Labourers","Construction and Mining Labourers",0.521619024521523,0.499529758947516,0.60285769692703,0.815720887167023,0.704753408246783
"274","47-3011.00","821","82","8",8215,"Paving and Surfacing Labourers","Helpers--Brickmasons, Blockmasons, Stonemasons, and Tile and Marble Setters","Labourers","Construction and Mining Labourers","Construction and Mining Labourers",0.523794600470225,0.540226981407034,0.635240915555684,0.773851108992527,0.623766161909937
"275","47-3015.00","821","82","8",8211,"Building and Plumbing Labourers","Helpers--Pipelayers, Plumbers, Pipefitters, and Steamfitters","Labourers","Construction and Mining Labourers","Construction and Mining Labourers",0.491349661838676,0.535092849313776,0.631067875443649,0.71560093475179,0.718241102110584
"276","47-4031.00","821","82","8",8213,"Fencers","Fence Erectors","Labourers","Construction and Mining Labourers","Construction and Mining Labourers",0.426218071194751,0.430005241675228,0.561462252020476,0.679953561389889,0.629881782474965
"277","47-4061.00","821","82","8",8216,"Railway Track Workers","Rail-Track Laying and Maintenance Equipment Operators","Labourers","Construction and Mining Labourers","Construction and Mining Labourers",0.558865215304486,0.528154926883838,0.625661014650652,0.735984828467745,0.651119437824977
"278","47-5021.00","712","71","7",7122,"Drillers, Miners and Shot Firers","Earth Drillers, Except Oil and Gas","Machinery Operators And Drivers","Machine and Stationary Plant Operators","Stationary Plant Operators",0.461388813249813,0.522554523419934,0.559352061707822,0.775122810312751,0.65563046662932
"279","49-2022.00","313","31","3",3132,"Telecommunications Technical Specialists","Telecommunications Equipment Installers and Repairers, Except Line Installers","Technicians And Trades Workers","Engineering, ICT and Science Technicians","ICT and Telecommunications Technicians",0.671762445091246,0.416056093486061,0.669486610773067,0.680480310985934,0.667099183029855
"280","49-2093.00","342","34","3",3423,"Electronics Trades Workers","Electrical and Electronics Installers and Repairers, Transportation Equipment","Technicians And Trades Workers","Electrotechnology and Telecommunications Trades Workers","Electronics and Telecommunications Trades Workers",0.697672065648887,0.567990228298672,0.503811063675333,0.593089090890712,0.568053377580766
"281","49-3011.00","323","32","3",3231,"Aircraft Maintenance Engineers","Aircraft Mechanics and Service Technicians","Technicians And Trades Workers","Automotive and Engineering Trades Workers","Mechanical Engineering Trades Workers",0.723668851516063,0.457477294135657,0.597779854151718,0.823464460806658,0.698919133395016
"282","49-3021.00","324","32","3",3241,"Panelbeaters","Automotive Body and Related Repairers","Technicians And Trades Workers","Automotive and Engineering Trades Workers","Panelbeaters, and Vehicle Body Builders, Trimmers and Painters",0.49602534063546,0.411168278174662,0.526500456778384,0.585411775341807,0.569027820642141
"283","49-3021.00","324","32","3",3242,"Vehicle Body Builders and Trimmers","Automotive Body and Related Repairers","Technicians And Trades Workers","Automotive and Engineering Trades Workers","Panelbeaters, and Vehicle Body Builders, Trimmers and Painters",0.49602534063546,0.411168278174662,0.526500456778384,0.585411775341807,0.569027820642141
"284","49-3023.01","321","32","3",3212,"Motor Mechanics","Automotive Master Mechanics","Technicians And Trades Workers","Automotive and Engineering Trades Workers","Automotive Electricians and Mechanics",0.662405376112163,0.465291169868097,0.612480833244299,0.796939266988444,0.656414230768565
"285","49-3023.02","321","32","3",3211,"Automotive Electricians","Automotive Specialty Technicians","Technicians And Trades Workers","Automotive and Engineering Trades Workers","Automotive Electricians and Mechanics",0.654823660920531,0.453030224776873,0.648671342592469,0.75572665427812,0.698509177450217
"286","49-9021.01","342","34","3",3421,"Airconditioning and Refrigeration Mechanics","Heating and Air Conditioning Mechanics and Installers","Technicians And Trades Workers","Electrotechnology and Telecommunications Trades Workers","Electronics and Telecommunications Trades Workers",0.53273061340231,0.453654738685756,0.609107364150284,0.749346401259203,0.690683864149519
"287","49-9043.00","899","89","8",8994,"Motor Vehicle Parts and Accessories Fitters","Maintenance Workers, Machinery","Labourers","Other Labourers","Miscellaneous Labourers",0.539004898866757,0.522392731862716,0.526982929899502,0.796028737261742,0.660437383911516
"288","49-9051.00","342","34","3",3422,"Electrical Distribution Trades Workers","Electrical Power-Line Installers and Repairers","Technicians And Trades Workers","Electrotechnology and Telecommunications Trades Workers","Electronics and Telecommunications Trades Workers",0.649311183303585,0.452504731700806,0.794093206708008,0.897876623630831,0.790354721254837
"289","49-9052.00","342","34","3",3424,"Telecommunications Trades Workers","Telecommunications Line Installers and Repairers","Technicians And Trades Workers","Electrotechnology and Telecommunications Trades Workers","Electronics and Telecommunications Trades Workers",0.691184440368139,0.553409300631986,0.724140619930408,0.78590009872377,0.68442349730438
"290","49-9071.00","899","89","8",8993,"Handypersons","Maintenance and Repair Workers, General","Labourers","Other Labourers","Miscellaneous Labourers",0.599414614668827,0.455011011394794,0.639193638612221,0.787906594560624,0.678479812749936
"291","49-9071.00","899","89","8",8991,"Caretakers","Maintenance and Repair Workers, General","Labourers","Other Labourers","Miscellaneous Labourers",0.599414614668827,0.455011011394794,0.639193638612221,0.787906594560624,0.678479812749936
"292","49-9091.00","899","89","8",8997,"Vending Machine Attendants","Coin, Vending, and Amusement Machine Servicers and Repairers","Labourers","Other Labourers","Miscellaneous Labourers",0.58784900696016,0.472082201915344,0.621255245287407,0.82997553669134,0.638509168238262
"293","49-9096.00","399","39","3",3991,"Boat Builders and Shipwrights","Riggers","Technicians And Trades Workers","Other Technicians and Trades Workers","Miscellaneous Technicians and Trades Workers",0.437651416544304,0.44049559846535,0.493763775151464,0.629115570549581,0.688264442380962
"294","51-1011.00","839","83","8",8393,"Product Quality Controllers","First-Line Supervisors of Production and Operating Workers","Labourers","Factory Process Workers","Miscellaneous Factory Process Workers",0.626556558270313,0.571433336177836,0.684507556022075,0.651680345582829,0.705057527322057
"295","51-2041.00","322","32","3",3221,"Metal Casting, Forging and Finishing Trades Workers","Structural Metal Fabricators and Fitters","Technicians And Trades Workers","Automotive and Engineering Trades Workers","Fabrication Engineering Trades Workers",0.436854991765826,0.473272861522044,0.483218555314468,0.527672689760125,0.467119221981755
"296","51-2092.00","832","83","8",8322,"Product Assemblers","Team Assemblers","Labourers","Factory Process Workers","Packers and Product Assemblers",0.726105249571575,0.618972737158645,0.560235923298497,0.683426756645929,0.557345130058408
"297","51-3011.00","351","35","3",3511,"Bakers and Pastrycooks","Bakers","Technicians And Trades Workers","Food Trades Workers","Food Trades Workers",0.517088265750696,0.447484205700235,0.677452396341236,0.525220566287484,0.579916774768593
"298","51-3011.00","351","35","3",3512,"Butchers and Smallgoods Makers","Bakers","Technicians And Trades Workers","Food Trades Workers","Food Trades Workers",0.517088265750696,0.447484205700235,0.677452396341236,0.525220566287484,0.579916774768593
"299","51-3022.00","831","83","8",8313,"Meat, Poultry and Seafood Process Workers","Meat, Poultry, and Fish Cutters and Trimmers","Labourers","Factory Process Workers","Food Process Workers",0.313574460464375,0.600179739272393,0.463244236332136,0.524877462514295,0.472026218317334
"300","51-3023.00","831","83","8",8312,"Meat Boners and Slicers, and Slaughterers","Slaughterers and Meat Packers","Labourers","Factory Process Workers","Food Process Workers",0.382685661117035,0.665275879253854,0.518551517537444,0.515718547071989,0.543046344582434
"301","51-3092.00","831","83","8",8311,"Food and Drink Factory Workers","Food Batchmakers","Labourers","Factory Process Workers","Food Process Workers",0.627618186534127,0.681839603608199,0.564692479432315,0.673044485836813,0.650804157619235
"302","51-4041.00","323","32","3",3232,"Metal Fitters and Machinists","Machinists","Technicians And Trades Workers","Automotive and Engineering Trades Workers","Mechanical Engineering Trades Workers",0.579498240232598,0.580838441395131,0.533010866593191,0.665549508018185,0.623445993228701
"303","51-4051.00","839","83","8",8391,"Metal Engineering Process Workers","Metal-Refining Furnace Operators and Tenders","Labourers","Factory Process Workers","Miscellaneous Factory Process Workers",0.558033773618367,0.619856535546894,0.483377611348865,0.721942273469582,0.599708571769343
"304","51-4192.00","323","32","3",3233,"Precision Metal Trades Workers","Layout Workers, Metal and Plastic","Technicians And Trades Workers","Automotive and Engineering Trades Workers","Mechanical Engineering Trades Workers",0.587353111887796,0.462662455051253,0.572290363734197,0.745862719937043,0.702621284498427
"305","51-4194.00","323","32","3",3234,"Toolmakers and Engineering Patternmakers","Tool Grinders, Filers, and Sharpeners","Technicians And Trades Workers","Automotive and Engineering Trades Workers","Mechanical Engineering Trades Workers",0.640264739858241,0.582322757571364,0.653573091901492,0.74973500411576,0.672222944530606
"306","51-5111.00","392","39","3",3922,"Graphic Pre-press Trades Workers","Prepress Technicians and Workers","Technicians And Trades Workers","Other Technicians and Trades Workers","Printing Trades Workers",0.631690097683189,0.622773104525222,0.56339415566479,0.494181168959908,0.649870815585914
"307","51-5112.00","392","39","3",3923,"Printers","Printing Press Operators","Technicians And Trades Workers","Other Technicians and Trades Workers","Printing Trades Workers",0.62219567583553,0.612913006097531,0.495522937506539,0.712051622598121,0.694456640361847
"308","51-5113.00","399","39","3",3996,"Signwriters","Print Binding and Finishing Workers","Technicians And Trades Workers","Other Technicians and Trades Workers","Miscellaneous Technicians and Trades Workers",0.485363962811457,0.2,0.349590812629711,0.612735385716541,0.294068920266152
"309","51-5113.00","899","89","8",8995,"Printing Assistants and Table Workers","Print Binding and Finishing Workers","Labourers","Other Labourers","Miscellaneous Labourers",0.485363962811457,0.2,0.349590812629711,0.612735385716541,0.294068920266152
"310","51-6011.00","811","81","8",8115,"Laundry Workers","Laundry and Dry-Cleaning Workers","Labourers","Cleaners and Laundry Workers","Cleaners and Laundry Workers",0.394572119314017,0.622677346356114,0.558817611445765,0.503826913722897,0.495599310516215
"311","51-6031.00","711","71","7",7116,"Sewing Machinists","Sewing Machine Operators","Machinery Operators And Drivers","Machine and Stationary Plant Operators","Machine Operators",0.404370901589566,0.634095651564211,0.46910629650391,0.511900867631885,0.482435971996518
"312","51-6041.00","393","39","3",3931,"Canvas and Leather Goods Makers","Shoe and Leather Workers and Repairers","Technicians And Trades Workers","Other Technicians and Trades Workers","Textile, Clothing and Footwear Trades Workers",0.329270823168251,0.443523483523756,0.479211092869166,0.414492483895391,0.498069981045073
"313","51-6063.00","711","71","7",7117,"Textile and Footwear Production Machine Operators","Textile Knitting and Weaving Machine Setters, Operators, and Tenders","Machinery Operators And Drivers","Machine and Stationary Plant Operators","Machine Operators",0.440623570876214,0.675534343144598,0.449569556807239,0.663308304501013,0.43427057035132
"314","51-6064.00","711","71","7",7119,"Other Machine Operators","Textile Winding, Twisting, and Drawing Out Machine Setters, Operators, and Tenders","Machinery Operators And Drivers","Machine and Stationary Plant Operators","Machine Operators",0.570923848843211,0.711497179543361,0.544940941763423,0.645182089818461,0.58334408305237
"315","51-6092.00","393","39","3",3932,"Clothing Trades Workers","Fabric and Apparel Patternmakers","Technicians And Trades Workers","Other Technicians and Trades Workers","Textile, Clothing and Footwear Trades Workers",0.75480659308156,0.515837888662907,0.619558619955052,0.551830789731296,0.728169152856974
"316","51-6093.00","393","39","3",3933,"Upholsterers","Upholsterers","Technicians And Trades Workers","Other Technicians and Trades Workers","Textile, Clothing and Footwear Trades Workers",0.501255257119172,0.560651144778817,0.544035583635855,0.666509926153935,0.610585139454971
"317","51-7011.00","394","39","3",3941,"Cabinetmakers","Cabinetmakers and Bench Carpenters","Technicians And Trades Workers","Other Technicians and Trades Workers","Wood Trades Workers",0.459341097327923,0.582718615506772,0.483823118088869,0.729827998961072,0.551068443439464
"318","51-7042.00","839","83","8",8394,"Timber and Wood Process Workers","Woodworking Machine Setters, Operators, and Tenders, Except Sawing","Labourers","Factory Process Workers","Miscellaneous Factory Process Workers",0.465276577811247,0.637957037430083,0.492588544039218,0.638231576467014,0.565119810864311
"319","51-7042.00","394","39","3",3942,"Wood Machinists and Other Wood Trades Workers","Woodworking Machine Setters, Operators, and Tenders, Except Sawing","Technicians And Trades Workers","Other Technicians and Trades Workers","Wood Trades Workers",0.465276577811247,0.637957037430083,0.492588544039218,0.638231576467014,0.565119810864311
"320","51-8013.00","399","39","3",3992,"Chemical, Gas, Petroleum and Power Generation Plant Operators","Power Plant Operators","Technicians And Trades Workers","Other Technicians and Trades Workers","Miscellaneous Technicians and Trades Workers",0.714613676604395,0.532334537340898,0.576375403756073,0.797819977607391,0.670068508713981
"321","51-8091.00","839","83","8",8399,"Other Factory Process Workers","Chemical Plant and System Operators","Labourers","Factory Process Workers","Miscellaneous Factory Process Workers",0.693562643058115,0.629563039320496,0.576764242345996,0.711503042451783,0.681957536655799
"322","51-8091.00","839","83","8",8392,"Plastics and Rubber Factory Workers","Chemical Plant and System Operators","Labourers","Factory Process Workers","Miscellaneous Factory Process Workers",0.693562643058115,0.629563039320496,0.576764242345996,0.711503042451783,0.681957536655799
"323","51-9021.00","711","71","7",7111,"Clay, Concrete, Glass and Stone Processing Machine Operators","Crushing, Grinding, and Polishing Machine Setters, Operators, and Tenders","Machinery Operators And Drivers","Machine and Stationary Plant Operators","Machine Operators",0.573166390089628,0.577903087904955,0.585927050611719,0.750925778890345,0.670139975010032
"324","51-9021.00","712","71","7",7123,"Engineering Production Workers","Crushing, Grinding, and Polishing Machine Setters, Operators, and Tenders","Machinery Operators And Drivers","Machine and Stationary Plant Operators","Stationary Plant Operators",0.573166390089628,0.577903087904955,0.585927050611719,0.750925778890345,0.670139975010032
"325","51-9032.00","711","71","7",7113,"Paper and Wood Processing Machine Operators","Cutting and Slicing Machine Setters, Operators, and Tenders","Machinery Operators And Drivers","Machine and Stationary Plant Operators","Machine Operators",0.682721815914962,0.739129658899438,0.626805375228892,0.744259341032788,0.611378728290786
"326","51-9051.00","711","71","7",7115,"Plastics and Rubber Production Machine Operators","Furnace, Kiln, Oven, Drier, and Kettle Operators and Tenders","Machinery Operators And Drivers","Machine and Stationary Plant Operators","Machine Operators",0.540799143392756,0.595222813239141,0.548910271113858,0.679169043027323,0.520407556009103
"327","51-9061.00","599","59","5",5995,"Inspectors and Regulatory Officers","Inspectors, Testers, Sorters, Samplers, and Weighers","Clerical And Administrative Workers","Other Clerical and Administrative Workers","Miscellaneous Clerical and Administrative Workers",0.620509362722479,0.584509528043206,0.539220475511024,0.542594565646612,0.61361121840609
"328","51-9071.01","399","39","3",3994,"Jewellers","Jewelers","Technicians And Trades Workers","Other Technicians and Trades Workers","Miscellaneous Technicians and Trades Workers",0.515446045779427,0.470377760172832,0.633682676455559,0.528966885583399,0.642571564142637
"329","51-9082.00","311","31","3",3112,"Medical Technicians","Medical Appliance Technicians","Technicians And Trades Workers","Engineering, ICT and Science Technicians","Agricultural, Medical and Science Technicians",0.601112604786241,0.435454552639678,0.731136398462424,0.721976990609978,0.694952647330595
"330","51-9121.00","711","71","7",7112,"Industrial Spraypainters","Coating, Painting, and Spraying Machine Setters, Operators, and Tenders","Machinery Operators And Drivers","Machine and Stationary Plant Operators","Machine Operators",0.578439460120051,0.644365607099117,0.519920521146537,0.733860969651922,0.614453071427571
"331","51-9122.00","324","32","3",3243,"Vehicle Painters","Painters, Transportation Equipment","Technicians And Trades Workers","Automotive and Engineering Trades Workers","Panelbeaters, and Vehicle Body Builders, Trimmers and Painters",0.424540005728984,0.548485396591707,0.556082497548669,0.636243024752793,0.518709609202651
"332","51-9123.00","332","33","3",3322,"Painting Trades Workers","Painting, Coating, and Decorating Workers","Technicians And Trades Workers","Construction Trades Workers","Floor Finishers and Painting Trades Workers",0.389525272081161,0.67967099832237,0.520884614565963,0.546977072107268,0.559930099166426
"333","51-9151.00","711","71","7",7114,"Photographic Developers and Printers","Photographic Process Workers and Processing Machine Operators","Machinery Operators And Drivers","Machine and Stationary Plant Operators","Machine Operators",0.53422373922462,0.2,0.434616292861141,0.575678211877291,0.310967798906363
"334","51-9194.00","392","39","3",3921,"Print Finishers and Screen Printers","Etchers and Engravers","Technicians And Trades Workers","Other Technicians and Trades Workers","Printing Trades Workers",0.579629182942873,0.631291156613912,0.586453519418271,0.6238124319062,0.640742115831639
"335","51-9195.07","712","71","7",7129,"Other Stationary Plant Operators","Molding and Casting Workers","Machinery Operators And Drivers","Machine and Stationary Plant Operators","Stationary Plant Operators",0.522052761752896,0.605516476251118,0.535103770942782,0.634468300439371,0.594992845708675
"336","51-9199.01","899","89","8",8996,"Recycling and Rubbish Collectors","Recycling and Reclamation Workers","Labourers","Other Labourers","Miscellaneous Labourers",0.554708512797557,0.557953615986366,0.560342916894689,0.713514233984502,0.588787732123413
"337","53-2011.00","231","23","2",2311,"Air Transport Professionals","Airline Pilots, Copilots, and Flight Engineers","Professionals","Design, Engineering, Science and Transport Professionals","Air and Marine Transport Professionals",0.805712669405635,0.689032566205838,0.646483647279908,0.766842784839816,0.75567815170926
"338","53-3011.00","411","41","4",4111,"Ambulance Officers and Paramedics","Ambulance Drivers and Attendants, Except Emergency Medical Technicians","Community And Personal Service Workers","Health and Welfare Support Workers","Health and Welfare Support Workers",0.626844507824471,0.408614627954409,0.794447952956516,0.657623208156812,0.70704531530797
"339","53-3022.00","731","73","7",7312,"Bus and Coach Drivers","Bus Drivers, School or Special Client","Machinery Operators And Drivers","Road and Rail Drivers","Automobile, Bus and Rail Drivers",0.456240282512316,0.418146670513334,0.587435724345735,0.594257084316385,0.509130731196821
"340","53-3031.00","731","73","7",7311,"Automobile Drivers","Driver/Sales Workers","Machinery Operators And Drivers","Road and Rail Drivers","Automobile, Bus and Rail Drivers",0.502356739084433,0.557535954234651,0.707204461003382,0.536413115885699,0.565775927315479
"341","53-3032.00","733","73","7",7331,"Truck Drivers","Heavy and Tractor-Trailer Truck Drivers","Machinery Operators And Drivers","Road and Rail Drivers","Truck Drivers",0.580295167059117,0.498278264824123,0.593866236097644,0.745065923623916,0.624560277969864
"342","53-3033.00","732","73","7",7321,"Delivery Drivers","Light Truck or Delivery Services Drivers","Machinery Operators And Drivers","Road and Rail Drivers","Delivery Drivers",0.523489461321174,0.551034582418399,0.618748374218423,0.669260337183776,0.569250409326782
"343","53-3033.00","721","72","7",7213,"Forklift Drivers","Light Truck or Delivery Services Drivers","Machinery Operators And Drivers","Mobile Plant Operators","Mobile Plant Operators",0.523489461321174,0.551034582418399,0.618748374218423,0.669260337183776,0.569250409326782
"344","53-4041.00","731","73","7",7313,"Train and Tram Drivers","Subway and Streetcar Operators","Machinery Operators And Drivers","Road and Rail Drivers","Automobile, Bus and Rail Drivers",0.533968756161955,0.704468524221442,0.642495415586264,0.676567982648643,0.564738621335593
"345","53-5021.01","231","23","2",2312,"Marine Transport Professionals","Ship and Boat Captains","Professionals","Design, Engineering, Science and Transport Professionals","Air and Marine Transport Professionals",0.733291338413228,0.494437282759006,0.788483883785371,0.855747269720721,0.832972175715272
"346","53-6031.00","621","62","6",6216,"Service Station Attendants","Automotive and Watercraft Service Attendants","Sales Workers","Sales Assistants and Salespersons","Sales Assistants and Salespersons",0.484316303376733,0.547981220605026,0.616264245412371,0.574316616473897,0.533786322734886
"347","53-6061.00","451","45","4",4517,"Travel Attendants","Transportation Attendants, Except Flight Attendants","Community And Personal Service Workers","Sports and Personal Service Workers","Personal Service and Travel Workers",0.528435775373993,0.523678470777568,0.718307755084715,0.572392454047471,0.598714308032444
"348","53-7011.00","721","72","7",7219,"Other Mobile Plant Operators","Conveyor Operators and Tenders","Machinery Operators And Drivers","Mobile Plant Operators","Mobile Plant Operators",0.540405026187858,0.517008024022472,0.560827061971042,0.694773829217208,0.589696319909106
"349","53-7021.00","712","71","7",7121,"Crane, Hoist and Lift Operators","Crane and Tower Operators","Machinery Operators And Drivers","Machine and Stationary Plant Operators","Stationary Plant Operators",0.441750081872505,0.658027592707873,0.504339032996712,0.722187911846419,0.537240012528358
"350","53-7061.00","811","81","8",8111,"Car Detailers","Cleaners of Vehicles and Equipment","Labourers","Cleaners and Laundry Workers","Cleaners and Laundry Workers",0.395957165288041,0.496237216684237,0.586770097778097,0.700303543135787,0.545116610091773
"351","53-7062.00","891","89","8",8911,"Freight and Furniture Handlers","Laborers and Freight, Stock, and Material Movers, Hand","Labourers","Other Labourers","Freight Handlers and Shelf Fillers",0.615204993196639,0.537519484307454,0.623629219256382,0.723674349888428,0.587142906440861
"352","53-7062.00","891","89","8",8912,"Shelf Fillers","Laborers and Freight, Stock, and Material Movers, Hand","Labourers","Other Labourers","Freight Handlers and Shelf Fillers",0.615204993196639,0.537519484307454,0.623629219256382,0.723674349888428,0.587142906440861
"353","53-7062.00","899","89","8",8999,"Other Miscellaneous Labourers","Laborers and Freight, Stock, and Material Movers, Hand","Labourers","Other Labourers","Miscellaneous Labourers",0.615204993196639,0.537519484307454,0.623629219256382,0.723674349888428,0.587142906440861
"354","53-7064.00","832","83","8",8321,"Packers","Packers and Packagers, Hand","Labourers","Factory Process Workers","Packers and Product Assemblers",0.575843052443622,0.601923030110437,0.695669850317681,0.648840804298499,0.578472659378813
