"Work Activity","4.A.4.a.7","Resolving Conflicts and Negotiating with Others","Handling complaints, settling disputes, and resolving grievances and conflicts, or otherwise negotiating with others."
"Work Activity","4.A.4.a.8","Performing for or Working Directly with the Public","Performing for people or dealing directly with the public. This includes serving customers in restaurants and stores, and receiving clients or guests."
"Work Activity","4.A.4.b.1","Coordinating the Work and Activities of Others","Getting members of a group to work together to accomplish tasks."
"Work Activity","4.A.4.b.2","Developing and Building Teams","Encouraging and building mutual trust, respect, and cooperation among team members."
"Work Activity","4.A.4.b.3","Training and Teaching Others","Identifying the educational needs of others, developing formal educational or training programs or classes, and teaching or instructing others."
"Work Activity","4.A.4.b.4","Guiding, Directing, and Motivating Subordinates","Providing guidance and direction to subordinates, including setting performance standards and monitoring performance."
"Work Activity","4.A.4.b.5","Coaching and Developing Others","Identifying the developmental needs of others and coaching, mentoring, or otherwise helping others to improve their knowledge or skills."
"Work Activity","4.A.4.b.6","Provide Consultation and Advice to Others","Providing guidance and expert advice to management or other groups on technical, systems-, or process-related topics."
"Work Activity","4.A.4.c.1","Performing Administrative Activities","Performing day-to-day administrative tasks such as maintaining information files and processing paperwork."
"Work Activity","4.A.4.c.2","Staffing Organizational Units","Recruiting, interviewing, selecting, hiring, and promoting employees in an organization."
"Work Activity","4.A.4.c.3","Monitoring and Controlling Resources","Monitoring and controlling resources and overseeing the spending of money."
